{
  "schema_version": 1,
  "id": "hybrid_gothic_detail_demo",
  "name": "Hybrid Gothic Detail Demo",
  "stage": "hybrid",
  "template": "library",
  "size": [
    45,
    15,
    33
  ],
  "style_profile": "style.massive_gothic_manor",
  "palette": "composition.massive_gothic_manor",
  "seed": 5007,
  "fixture_policy": {
    "density": 0.9,
    "max_repeats": 4
  },
  "slots": [
    {
      "id": "mb_crest",
      "selector": {
        "stage": "microblock",
        "category": "decor",
        "families": [
          "crests"
        ],
        "preferred_ids": [
          "crest_shield"
        ]
      },
      "target": {
        "x": "center",
        "y": 8,
        "z": "min+1"
      },
      "rotation": 2,
      "required": true
    },
    {
      "id": "mb_gargoyle",
      "selector": {
        "stage": "microblock",
        "category": "decor",
        "families": [
          "statues"
        ],
        "preferred_ids": [
          "gargoyle_head_abstract"
        ]
      },
      "target": {
        "x": "min+4",
        "y": 9,
        "z": "min+2"
      },
      "rotation": 1,
      "required": true
    },
    {
      "id": "mb_lantern",
      "selector": {
        "stage": "microblock",
        "category": "lighting",
        "families": [
          "fixtures"
        ],
        "preferred_ids": [
          "lantern_cage"
        ]
      },
      "target": {
        "x": "25%",
        "y": "ceiling-3",
        "z": "65%"
      },
      "rotation": 3,
      "required": true
    },
    {
      "id": "mb_frame",
      "selector": {
        "stage": "microblock",
        "category": "decor",
        "families": [
          "frames"
        ],
        "preferred_ids": [
          "picture_frame_corner"
        ]
      },
      "target": {
        "x": "80%",
        "y": 7,
        "z": "max-1"
      },
      "rotation": 3,
      "required": true
    }
  ]
}
